{
  "$ref": "#/definitions/NiggleMobility",
  "definitions": {
    "NiggleMobility": {
      "type": "object",
      "properties": {
        "wrist": {
          "type": "array",
          "items": {
            "type": "string",
            "pattern": "^[a-z0-9]+(-[a-z0-9]+)*$"
          },
          "minItems": 1,
          "maxItems": 5
        },
        "shoulder": {
          "type": "array",
          "items": {
            "type": "string",
            "pattern": "^[a-z0-9]+(-[a-z0-9]+)*$"
          },
          "minItems": 1,
          "maxItems": 5
        },
        "elbow": {
          "type": "array",
          "items": {
            "type": "string",
            "pattern": "^[a-z0-9]+(-[a-z0-9]+)*$"
          },
          "minItems": 1,
          "maxItems": 5
        },
        "knee": {
          "type": "array",
          "items": {
            "type": "string",
            "pattern": "^[a-z0-9]+(-[a-z0-9]+)*$"
          },
          "minItems": 1,
          "maxItems": 5
        },
        "lower_back": {
          "type": "array",
          "items": {
            "type": "string",
            "pattern": "^[a-z0-9]+(-[a-z0-9]+)*$"
          },
          "minItems": 1,
          "maxItems": 5
        }
      },
      "required": [
        "wrist",
        "shoulder",
        "elbow",
        "knee",
        "lower_back"
      ],
      "additionalProperties": false
    }
  },
  "$schema": "http://json-schema.org/draft-07/schema#"
}
