{
  "wrist": ["wrist-circles", "wrist-rocks", "elbow-cars"],
  "shoulder": ["shoulder-cars", "wall-slide", "band-external-rotation", "thoracic-extension"],
  "elbow": ["elbow-cars", "forearm-flexor-stretch", "forearm-extensor-stretch", "wrist-circles"],
  "knee": ["heel-slides", "band-terminal-knee-extension", "hip-circle"],
  "lower_back": ["pelvic-tilt", "cat-cow", "child-pose", "ninety-ninety", "hip-circle"]
}
